popupOpenRecent.png; "Sélectionnez directement n'importe quel émoji depuis votre navigateur avec ce sélecteur.";
popupDarkMode.png; "Prend en charge le mode sombre de votre système automatiquement.";
popupSearchLikeApple.png; "Vous pouvez changer l'apparence des émojis et leur largeur.";
popupSelectFemaleDetective.png; "Les émoticônes peuvent être copiés ...";
popupAppleInsertDogOnMastodon.png; "... ou insérés directement dans la page courante.";
emojiSearchAddressBarDog.png; "Cherchez des émojis directement dans votre barre d'addresse (doit être activé manuellement).";
popupBigEmojisApple.png; "Ajustez la taille de tous les emojis!";
popupMediumSkinSearchDoctor.png; "Ajustez la couleur de peau et recherchez des émojis.";
options.png; "Voici la page complète des paramètres, avec toutes les options ajustables.";
